name,description,rating
Omni Nashville Hotel,"The 5,500-square-foot fitness center at Omni Nashville Hotel is open 24/7.Gym equipment includes treadmills, ellipticals, stationary bikes, free weights, benches, a rower, and a leg press.",4
JW Marriott Nashville,"The fitness center at the JW Marriott is open 24/7 and offers guests the opportunity to work out while enjoying views of Nashville. The gym is equipped with treadmills, elliptical machines, a StairMaster, a rower, a Peloton bike, weight machines, dumbbells, and benches.",3
Nashville Marriott at Vanderbilt University,"The 2,000-square-foot fitness center at the Nashville Marriott at Vanderbilt University is open 24 hours a day and offers views of Vanderbilt Stadium.Gym equipment includes treadmills, elliptical machines, a rower, weight machines, cable machines, dumbbells, kettlebells, and benches.",4
"Noelle, Nashville, A Tribute Portfolio Hotel","The renovated fitness center at Noelle, Nashville is open 24 hours a day, 7 days a week. Gym equipment includes a Peloton bike, treadmills, ellipticals, dumbbells, kettlebells, cable machines, benches, battle ropes, and TRX training straps.",4
Moxy Nashville Downtown,"The state-of-the-art fitness center at the Moxy Nashville Downtown is open 24/7 and well-equipped with a wide variety of equipment.Gym equipment includes treadmills, ellipticals, a stationary bike, a cable machine, dumbbells, barbells, benches, pull-up bars, TRX training straps, battle ropes, and a boxing bag.",4
Cambria Nashville Downtown Hotel,"The fitness center at the Cambria Nashville Downtown Hotel is open 24 hours a day, 7 days a week.Equipment includes treadmills, ellipticals, slam balls, suspension trainers, battle ropes, dumbbells, kettlebells, and pull-up bars.",4
Gaylord Opryland Resort and Convention Center,"The 3,500-square-foot fitness center at Gaylord Opryland Resort and Convention Center is open 24 hours a day, 7 days a week.Gym equipment includes treadmills, ellipticals, weight machines, cable machines, dumbbells, barbells, and benches.",4
Holston House Nashville - The Unbound Collection by Hyatt,"The fitness center at Holston House Nashville is open 24 hours a day. Gym equipment includes treadmills, elliptical machines, a rower, weight machines, cable machines, dumbbells, kettlebells, and benches.",4
W Nashville,"The fitness center at the W Nashville is open 24 hours a day, 7 days a week.Gym equipment includes treadmills, elliptical machines, Peloton bikes, a rower, a StairMaster, weight machines, dumbbells, kettlebells, gymnastics rings, and boxing equipment.If hotel gyms aren’t your thing, consider some of these gym memberships that are good for traveling.",4
Boston Park Plaza,"The 20,000-square-foot Lynx Fitness Club is located at the Boston Park Plaza and is open to guests of the hotel.The gym features treadmills, ellipticals, stationary bikes (including Peloton bikes), Concept2 rowing machines, Assault bikes, a SkiErg, weight machines, dumbbells, barbells, kettlebells, benches, gymnastics rings, and a turf area with a Rogue sled.For those looking for group fitness, Lynx offers 55+ group classes per week including Yoga, HIIT, Barre, Tabata, Bootcamp, Boxing, and Treadmill Training. Gym memberships are available.",5
"Four Seasons Hotel One Dalton Street, Boston","The fitness center at the Four Seasons Hotel One Dalton Street is open 24 hours a day, 7 days a week. Gym equipment includes treadmills, ellipticals, Peloton bikes, rowers, a StairMaster, weight machines, cable machines, dumbbells, barbells, kettlebells, and a squat rack.",5
Marriott Boston Quincy,"The fitness center at the Boston Marriott Quincy is open 24/7 and features a host of Reebok-sponsored equipment. In this top-notch gym, you’ll find treadmills, ellipticals, stationary bikes, weight machines, dumbbells, kettlebells, barbells, benches, and a squat rack - most of it Reebok.",5
Omni Parker House,"The fitness center at Omni Parker House is open 24/7.Gym equipment includes weight machines, ellipticals, stationary bikes (including Peloton), a StairMaster, treadmills, dumbbells, kettlebells, and benches.",4
Boston Harbor Hotel,"The fitness center at Boston Harbor Hotel is open Monday to Friday, 5:30 a.m. to 9:00 p.m., Saturday, 7:00 a.m. to 9:00 p.m., and on Sunday from 7:00 a.m. to 8:00 p.m.Gym equipment includes treadmills, ellipticals, a StairMaster, weight machines, dumbbells, and benches.",4
InterContinental Boston,"SPA InterContinental Boston is over 6,000 square feet and its fitness center is open 24/7.The gym equipment includes treadmills, ellipticals, stationary bikes, dumbbells, barbells, kettlebells, a rowing machine, weight machines, and Rogue boxes.",3
Hyatt Regency Boston,"Hyatt Regency Boston’s StayFit Gym is a modern fitness center that offers treadmills, stationary bikes, elliptical machines, rowing machines, weight machines, dumbbells, kettlebells, and battle ropes.If you prefer running or biking outside, the concierge will provide you with maps of local running and biking paths.",4
Four Seasons Hotel Boston,"The newly-renovated fitness center at the Four Seasons Hotel in downtown Boston is open 24 hours and is equipped with treadmills, stationary bikes, elliptical trainers, TRX straps, dumbbells, benches, barbells, weight machines, and kettlebells.The Four Seasons Hotel Boston has also partnered with performance lifestyle brand TB12, co-founded by Tom Brady, to add a football-inspired turf area for functional training and a team of personal trainers from Brady’s company.",5
"The Westin Copley Place, Boston","The spacious fitness studio at The Westin Copley Place, Boston is open 24 hours a day and features treadmills, ellipticals, stationary bikes (including Peloton bikes), weight machines, dumbbells, kettlebells, TRX, benches, a cable machine with pull-up bars, boot camp classes.",4
Residence Inn Boston Cambridge,"The fitness center at the Residence Inn Boston Cambridge is open 24 hours a day, 7 days a week.Gym equipment includes treadmills, Peloton bikes, a StairMaster, dumbbells, kettlebells, and benches.",4
Thompson Austin - Part of Hyatt and Tommie Austin - JDV by Hyatt,"The 6,700-square-foot fitness center at Thompson Austin and Tommie Austin is located on the third floor of the hotel. Gym equipment includes treadmills, ellipticals, Peloton bikes, StairMasters, a rower, dumbbells, kettlebells, barbells, pull-up bars, benches, and a squat rack. There’s also a lounge area and an indoor golf simulator.",5
JW Marriott Austin,"The fitness center at the JW Marriott Austin is open 24 hours a day, 7 days a week.Equipment in the JW Marriott Austin fitness center includes treadmills, spin bikes, ellipticals, dumbbells (up to 50 pounds), kettlebells, barbells, benches, weight machines, and a power rack.",5
The Westin Austin Downtown,"The WestinWORKOUT Fitness Studio at The Westin Austin Downtown is open 24 hours a day, 7 days a week.Equipment includes cardio machines, weight machines, dumbbells, kettlebells, TRX straps and medicine balls, and a Peloton bike.Refuel post-workout with a power snack and vitamin-filled juice or enjoy a rooftop yoga class.",4
W Austin,"The 3,600 square-foot FIT gym at the W Austin is open 24 hours a day, 7 days a week.Equipment includes treadmills, ellipticals, an air bike, a StairMaster, weight machines, barbells, dumbbells, kettlebells, a squat rack, and Peloton bikes.",5
Hilton Austin Hotel,"The Skyline Spa and Health Club at the Hilton Austin is open daily from 8 am to 7 pm. Gym equipment includes cardio machines, weight machines, barbells, dumbbells, benches, and a Smith machine.",4
Omni Barton Creek Resort and Spa,"The 11,000-square-foot  fitness center at the Omni Barton Creek Resort and Spa is open from 5 am to 9:30 pm Monday through Friday and 6 am to 9 pm on Saturday and Sunday.Equipment includes treadmills, Peloton bikes, weight machines, dumbbells, kettlebells, barbells, benches, a squat rack, and a turf area.",5
The Westin Austin at The Domain,"The WestinWORKOUT Fitness Studio at The Westin Austin at The Domain is open 24 hours a day, 7 days a week.Equipment includes treadmills, ellipticals, Peloton bikes, weight machines, a cable machine with pull-up bars, dumbbells, and benches.",4
Four Seasons Hotel Austin,"The fitness center at the Four Seasons Hotel Austin is open 24 hours a day, 7 days a week.Gym equipment includes treadmills, ellipticals, Peloton bikes, a rower, a StairMaster, weight machines, dumbbells, kettlebells, and benches.",4
Austin Proper Hotel,"The 2,000+-square-foot fitness center at the Austin Proper Hotel is open 24 hours a day, 7 days a week.Equipment includes treadmills, ellipticals, rowers, Peloton bikes, a StairMaster, cable machines, dumbbells, barbells, kettlebells, benches, and a squat rack.",5
Fairmont Austin,"The 2,800-square-foot fitness center at the Fairmont Austin is located on the sixth floor and features floor-to-ceiling windows.Gym equipment includes treadmills, ellipticals, Peloton bikes, a StairMaster, weight machines, cable machines, dumbbells, barbells, a squat rack, and benches.If hotel gyms aren’t for you, consider gym memberships like Planet Fitness, Anytime Fitness, or LA Fitness. Each gym chain offers membership perks that include access to any of its many locations.",5
Manchester Grand Hyatt San Diego,"The StayFit Fitness Center at the Manchester Grand Hyatt San Diego is open 24 hours a day, 7 days a week, and offers waterfront views through the gym’s floor-to-ceiling windowsGym equipment includes treadmills, ellipticals, Peloton bikes, a StairMaster, a rower, weight machines, dumbbells, barbells, and benches.",4
"Hotel del Coronado, Curio Collection by Hilton","The fitness center at Hotel del Coronado, Curio Collection by Hilton is open 24 hours a day, 7 days a week.Gym equipment includes Air Runner treadmills, Peloton bikes, rowers, dumbbells, barbells, squat racks, benches, and boxing equipment.",5
"Carte Hotel San Diego Downtown, Curio Collection by Hilton","Guests of the Carte Hotel, Curio Collection by Hilton have access to Fit Athletic Club & Gym, located in the same building. Fit Athletic is open from 5 am to 9 pm Monday-Friday and 7 am to 7 pm Saturday and Sunday. The gym has cardio machines, weight machines, dumbbells, barbells, kettlebells, squat racks, studios, turf areas, and a rooftop training area.",5
Sheraton San Diego Hotel and Marina,"The recently updated fitness center at the Sheraton San Diego Hotel and Marina is open 24 hours a day, 7 days a week.Gym equipment includes treadmills, ellipticals, Peloton bikes, weight machines, dumbbells, kettlebells, and benches.",4
"InterContinental San Diego, an IHG Hotel","The 3,300 square-foot health and wellness center at the InterContinental San Diego features cardio machines, weight machines, free weights, a fitness-on-demand video studio that offers an array of classes, and beautiful waterfront views through floor-to-ceiling windows.",4
Marriott Marquis San Diego Marina,"The fitness center at the Marriott Marquis San Diego Marina is open 24/7.Equipment includes more than 40 cardio machines (including 3 Peloton bikes), free weights (including dumbbells and kettlebells), a Smith machine, a rowing machine, weight machines, TRX, battle ropes, and a stretching area.There are also fitness classes led by certified trainers available in yoga, spinning, and Zumba, and fitness-on-demand virtual classes available 24/7 on a 120-inch screen.",4
Omni San Diego Hotel,"The state-of-the-art fitness center at the Omni San Diego Hotel is open 24 hours a day, 7 days a week.Gym equipment includes treadmills, ellipticals, Peloton bikes, StairMasters, weight machines, benches, and dumbbells.",4
The Westgate Hotel,"The 40,000-square-foot AquaVie fitness center at the Westgate Hotel is open from 5 am to 10 pm Monday through Friday and from 7 am to 7 pm on the weekends. The gym features 200+ cardio machines and weight machines, dumbbells, barbells, squat racks, group exercise rooms, a rooftop training area, a lap pool, and running track, and a full-service spa. Memberships are available.",5
The Westin San Diego Gaslamp Quarter,"The WestinWORKOUT® Fitness Studio at the Westin San Diego Gaslamp Quarter is open 24 hours a day, 7 days a week. Gym equipment includes treadmills, ellipticals, stationary bikes (including Peloton), TRX, a cable machine, dumbbells, kettlebells, and benches.",4
The Alexis Royal Sonesta Hotel,"The fitness center at The Alexis Royal Sonesta Hotel is a functional fitness enthusiast’s paradise.Gym equipment includes treadmills, a Peloton bike, an Assault Air Bike, a rowing machine, dumbbells, kettlebells, rings, monkey bars, a pull-up bar, and a rock climbing wall.",4
Hyatt Regency Bellevue On Seattle's Eastside,"The 7,000-square-foot, state-of-the-art Stayfit Fitness Center at Hyatt Regency Bellevue on Seattle’s Eastside is open 24 hours a day. Gym equipment includes elliptical machines, treadmills, strength equipment, box jumps, weight balls, kettlebells, barbells, squat racks, dumbbells, benches, and two Peloton bikes.",5
The Alexis Royal Sonesta Hotel,"The fitness center at The Alexis Royal Sonesta Hotel is a functional fitness enthusiast’s paradise. Gym equipment includes treadmills, a Peloton bike, an Assault Air Bike, a rowing machine, dumbbells, kettlebells, rings, monkey bars, a pull-up bar, and a rock climbing wall.",4
Sheraton Grand Seattle,"The fitness center at the Sheraton Grand Seattle is open 24 hours a day, seven days a week.Gym equipment includes treadmills, ellipticals, bikes, weight machines, dumbbells, and benches.",4
Renaissance Seattle Hotel,"The fitness center at the Renaissance Seattle Hotel is open 24 hours a day, seven days a week.Gym equipment includes treadmills, ellipticals, spin bikes, weight machines, a cable machine, dumbbells, and a pull-up bar.",4
Residence Inn Seattle Sea-Tac Airport,"The fitness center at the Residence Inn Seattle Sea-Tac Airport is open 24 hours a day, seven days a week.Gym equipment includes treadmills, ellipticals, weight machines, dumbbells, cable machines, a pull-up bar, benches, resistance bands, medicine balls, and mats.",3
Four Seasons Hotel Seattle,"The fitness center at the Four Seasons Hotel Seattle is open 24 hours a day, seven days a week.Gym equipment includes treadmills, ellipticals, Peloton bikes, weight machines, dumbbells, kettlebells, benches, cable machines, and a pull-up bar.",4
DoubleTree Suites by Hilton Hotel Seattle Airport,"The fitness center at DoubleTree Suites by Hilton Hotel Seattle Airport is open 24 hours a day, seven days a week.Gym equipment includes treadmills, ellipticals, a spin bike, a Concept 2 rower, an Assault AirRunner, dumbbells, and benches.",4
Grand Hyatt Seattle,"The 3,800-square-foot StayFit fitness center at the Grand Hyatt Seattle is open 24 hours a day, seven days a week.Gym equipment includes treadmills, ellipticals, Peloton bikes, weight machines, dumbbells, barbells, benches, stability balls, medicine balls, and jump ropes.",4
Hyatt Regency Seattle,"The StayFit gym at the Hyatt Regency Seattle is open 24 hours a day, seven days a week.Gym equipment includes treadmills, ellipticals, Peloton bikes, weight machines, a rowing machine, cable machines, pull-up bars, a Smith machine, dumbbells, kettlebells, and benches.",4
Hyatt at Olive 8,"The spacious StayFit gym at Hyatt at Olive 8 is open 24 hours a day, seven days a weekGym equipment includes treadmills, ellipticals, Peloton bikes, weight machines, dumbbells, barbells, benches, a cable machine, and a pull-up bar.",4
Omni Houston Hotel,"The fitness center at the Omni Houston Hotel is open 24 hours a day, seven days a week.Gym equipment includes weight machines, barbells, benches, dumbbells, kettlebells, and cardio machines, including a Peloton bike and Concept2 rower.",0
JW Marriott Houston by the Galleria,"The fitness center at the JW Marriott Houston by the Galleria is open 24 hours a day, seven days a week.The gym is equipped with cardio machines, weight machines, dumbbells, barbells, benches, and a squat rack.",0
Marriott Marquis Houston,"The fitness center at the Marriott Marquis Houston is open 24 hours a day, seven days a week.Gym equipment includes treadmills, stationary bikes, a StairMaster, weight machines, kettlebells, dumbbells, a cable machine, a Smith machine, and a leg press.",0
The Houstonian Hotel,"The Houstonian Hotel has been a pioneer in the hotel gym world, opening its 125,000-square-foot Health Club back in 1980.Guests can enjoy access to 300-plus cardio and strength machines, a staff of exercise and nutrition specialists, indoor running tracks, tennis and racquetball courts, a pool, a yoga studio, and studios for classes.",0
Houston Airport Marriott at George Bush Intercontinental,"We consider it important to include hotels that are close to area airports, so here you have the fitness center at the Houston Airport Marriott at George Bush Intercontinental.The fitness center is open 24 hours a day, seven days a week, and features a wide range of cardio machines and weight machines, as well as free weights.",0
Hyatt Regency Houston/Galleria,"The StayFit Gym at the Hyatt Regency Houston/Galleria is open 24 hours a day, seven days a week.Gym equipment includes treadmills, ellipticals, stationary bikes, cable machines, dumbbells, and benches.",0
Hilton Americas-Houston Hotel,"The fitness center in the Skyline Spa and Health Club at the Hilton Americas-Houston Hotel is open 24/7 and features cardio machines, weight machines, benches, dumbbells (including heavy ones), a cable machine, and a pull-up bar.",0
Holiday Inn Express & Suites Houston Westchase - Westheimer,"The fitness center at the Holiday Inn Express & Suites Houston Westchase - Westheimer offers a perfect place for functional fitness enthusiasts and CrossFitters to get in a workout on the go.The gym has the typical cardio machines you’d expect in a hotel gym, plus an Assault bike, dumbbells, a Concept2 rower, Plyosoft boxes, a sled, a tire, and a turf area.",0
Wyndham Grand Orlando Resort Bonnet Creek,"The spacious fitness center at the Wyndham Grand Orlando Resort Bonnet Creek is open 24 hours a day, seven days a week.Gym equipment includes treadmills, ellipticals, stationary bikes, weight machines, a cable machine, a pull-up bar, dumbbells, and benches.Note: The Wyndham has a $32 a day resort fee.",0
Universal’s Cabana Bay Beach Resort,"The Jack LaLanne Physical Fitness Studio at Universal’s Cabana Bay Beach Resort is one of the most unique hotel fitness centers you’ll find anywhere.Open from 5 AM until midnight, this spacious gym features tributes to the fitness pioneer and treadmills, ellipticals, stationary bikes, dumbbells, barbells, benches, a cable machine, and a pull-up bar.",0
Hilton Orlando,"The 4,000-square-foot fitness center at the Hilton Orlando is open 24 hours a day, seven days a week.Gym equipment includes treadmills, stationary bikes, ellipticals, dumbbells, benches, a Smith machine, cable machines, and a pull-up bar.",0
Orlando World Center Marriott,"The fitness center at the Orlando World Center Marriott is open 24/7.Gym equipment includes treadmills, ellipticals, stationary bikes, dumbbells, barbells, benches, a Smith machine, a pull-up bar, and a cable machine.",0
Loews Sapphire Falls Resort at Universal Orlando,"The Kalina Fitness Center at the Loews Sapphire Falls Resort at Universal Orlando is spacious and well-equipped.Gym equipment includes treadmills, ellipticals, stationary bikes, a StairMaster, weight machines, a Smith machine, a cable machine, dumbbells, and benches.",0
Waldorf Astoria Orlando,"The 4,000-square-foot fitness center at the Waldorf Astoria Orlando is open 24/7.Gym equipment includes treadmills, ellipticals, stationary bikes, a rower, weight machines, benches, dumbbells, a cable machine, and a pull-up bar.",0
The Florida Hotel & Conference Center,"The spacious fitness center at The Florida Hotel & Conference Center is open 24 hours a day, 7 days a week.Gym equipment includes treadmills, ellipticals, Peloton bikes, rowers, dumbbells, benches, cable machines, and weight machines.",0
Four Seasons Resort Orlando at Walt Disney World Resort,"The beautifully-designed and spacious fitness center at the Four Seasons Resort Orlando at Walt Disney World Resort is open 24 hours a day, 7 days a week.Gym equipment includes treadmills, ellipticals, stationary bikes, rowers, a stair climber, weight machines, a cable machine, a pull-up bar, dumbbells, kettlebells, resistance bands, and benches.Complimentary fitness apparel and athletic shoes are available for use during your stay.",0
Disney’s Animal Kingdom Lodge,"The Zahanati Massage & Fitness Center at Disney’s Animal Kingdom Lodge is the best gym in a Disney resort and is open 24 hours a day, seven days a week.Gym equipment includes treadmills, ellipticals, stationary bikes, dumbbells, barbells, benches, and a Smith machine.",0
AC Hotel Charlotte City Center,"The fitness center at the AC Hotel Charlotte City Center is open 24 hours a day, seven days a week and features treadmills, ellipticals, a stairmaster, a stationary bike, weight machines, a cable machine with pull-up bars, benches, and dumbbells.There’s also floor-to-ceiling windows with beautiful views of Charlotte and a fitness patio for some outdoor stretching or yoga.",0
Hilton Charlotte Center City,"Guests of the Hilton Charlotte Center City have complimentary access to the attached Childress Klein YMCA Health Club and its swimming pool, basketball courts, barbells, dumbbells, kettlebells, cardio machines, weight machines, cycle studio, functional fitness rig, battle ropes, Assault Bike, and much more.",0
Omni Charlotte Hotel,"Guests of the Omni Charlotte Hotel receive complimentary access to the 36,000 square foot Charlotte Athletic Club that’s connected to the hotel. The health club features a wide range of cardio machines, weight machines, free weights, functional fitness equipment, a cycling studio, a yoga and Pilates studio, a basketball court, a steam room, and a sauna.",0
The Ivey’s Hotel,"The fitness center at The Ivey’s Hotel is open 24 hours a day, seven days a week and features treadmills, a Smith machine, a cable machine with a pull-up bar, various weight machines,  benches, dumbbells, medicine balls, and resistance bands.",0
Charlotte Marriott City Center,"The fitness center at the Charlotte Marriott City Center is open 24 hours a day, seven days a week and features treadmills, ellipticals, a stairmaster, weight machines, cable machines, pull-up bars, battle ropes, TRX suspension trainer, dumbbells, kettlebells, benches, and multiple interactive classes offered in a studio with a video wall.",0
"The Ballantyne, a Luxury Collection Hotel, Charlotte","The fitness center at the The Ballantyne, a Luxury Collection Hotel, Charlotte is 24 hours a day, seven days a week and features treadmills, ellipticals, stationary bikes, medicine balls, resistance bands, a punching bag, kettlebells, dumbbells, barbells, weight machines, and benches.Cover photo by Kimpton Tryon Park Hotel.",0
"The Ballantyne, a Luxury Collection Hotel, Charlotte","The fitness center at the The Ballantyne, a Luxury Collection Hotel, Charlotte is 24 hours a day, seven days a week and features treadmills, ellipticals, stationary bikes, medicine balls, resistance bands, a punching bag, kettlebells, dumbbells, barbells, weight machines, and benches.Cover photo by Kimpton Tryon Park Hotel.",0
Philadelphia Airport Marriott,"The fitness center at the Philadelphia Airport Marriott is open 24 hours a day, seven days a week and features cardio machines, weight machines, a stairmaster, a cable machine with a pull-up bar, benches, and dumbbells.",0
Philadelphia Marriott Downtown,"The spacious fitness center at the Philadelphia Marriott Downtown is open 24 hours a day and features treadmills, ellipticals, stationary bikes, a stairmaster, weight machines, a cable machine with a pull-up bar, benches, dumbbells, medicine balls, and mats for stretching.",0
Club Quarters Hotel,"At the Club Quarters Hotel, you’ll find a gym stocked with cardio equipment and free weights, including a Peloton bike. You’ll also find a yoga mat and resistance bands in each room if you don’t feel like hitting the gym but still want to get a workout in.",0
Residence Inn Philadelphia Center City,"The fitness center at the Residence Inn Philadelphia Center City features treadmills, ellipticals, stationary bikes, benches, dumbbells (including heavy ones), and weight machines.",0
Sheraton Suites Philadelphia Airport,"The fitness center at the Sheraton Suites Philadelphia Airport is open 24 hours a day and features treadmills, stationary bikes, ellipticals, a cable machine with a pull-up bar, benches, dumbbells, stability balls, and mats.",0
Loews Philadelphia Hotel,"This is a weightlifter’s hotel gym. The 2,000 square-foot fitness center at Loews Philadelphia Hotel features dumbbells, barbells, kettlebells, benches, a boxing bag, treadmills, ellipticals, and stationary bikes, including two Peloton bikes. The gym’s hours are 5am to 9:30pm.",0
The Westin Denver Downtown,"The WestinWORKOUT Studio at The Westin Denver Downtown is open from 5 am to 11 pm.Gym equipment includes treadmills, ellipticals, Peloton bikes, a rowing machine, dumbbells, benches, cable machines, a pull-up bar, and a TRX Training Zone with kettlebells, medicine balls, and suspension trainers.",0
Sheraton Denver Downtown Hotel,"The spacious fitness center at the Sheraton Denver Downtown Hotel is open 24 hours a day.Equipment includes treadmills, ellipticals, Peloton bikes, weight machines, dumbbells, barbells, and benches.This is a weightlifter’s hotel gym.",0
