name,description,rating
The Hotel & Athletic Club at Midtown,"Hotel gyms are usually a small part of the hotel but the reverse is true at the Hotel & Athletic Club at Midtown. This is a hotel in a gym and it's incredible. The 575,000-square-foot facility features six levels with Crossfit and athletic performance programs on a 40-foot turf field, a full gym with cardio and strength equipment, gold simulators, pools, tennis courts, and more. Memberships are available.",5
Chicago Marriott Downtown Magnificent Mile,"The 9,000-square-foot gym at the Chicago Marriott Downtown Magnificent Mile is open 24 hours a day, 7 days a week.Gym equipment includes treadmills, ellipticals, stationary bikes, weight machines, cable machines, dumbbells, kettlebells, and benches.",4
Marriott Marquis Chicago,"The fitness center at Marriott Marquis Chicago is open 24/7.Gym equipment includes treadmills, ellipticals, a rower, a Stairmaster, weight machines, cable machines, dumbbells, barbells, and a Smith machine.",4
JW Marriott Chicago,"The spacious fitness center at the JW Marriott Chicago is open 24 hours a day, 7 days a week.Gym equipment includes treadmills, ellipticals, stationary bikes, weight machines, cable machines, a smith machine, dumbbells (up to 80 pounds), kettlebells, barbells, and benches.",5
The Westin Chicago River North,"WestinWORKOUT Fitness Studios can always be counted on for an exceptional fitness experience and the one in the Westin Chicago River North is no different. The gym is open 24 hours and has standard cardio machines, plus two Peloton bikes, a water-driven rowing machine, kettlebells, slam balls, plyometric boxes, free weights, benches, and dumbbells up to eighty pounds. A personal trainer and New Balance Gear Lending are available on request.",4
Hilton Chicago O'Hare Airport,"The fitness center at Hilton Chicago O’Hare Airport is fully equipped with free weights that will keep weight lifters happy while traveling. Gym equipment includes weight machines, cable machines, barbells, dumbbells, benches, and a squat rack.",5
Four Seasons Chicago,"Open 24 hours and over 2,000 square feet, the Fitness Club at the Four Seasons in Chicago is a great facility for travelers who want to maintain their routine on the road. The gym is fully equipped with cardio machines (including Peloton bikes), weight machines, free weights, and plenty of space to stretch out. Personal training and guided runs along Lake Michigan are also available. Take a virtual tour of the Fitness Club here.",3
"The Ritz-Carlton, Chicago","The 2,700 square-foot fitness center at the Ritz-Carlton is open 24 hours a day and has floor-to-ceiling windows with views of Navy Pier, Lake Michigan, and the Chicago skyline. Gym equipment includes treadmills, ellipticals, stationary bikes, weight machines, cable machines, dumbbells, barbells, kettlebells, benches, and a squat rack.",4
Hilton Chicago,"The 25,000-square-foot fitness center at the Hilton Chicago is open 5 am to 9 pm Monday through Thursday, 5 am to 10 pm on Friday, 6 am to 10 pm on Saturday, and 6 am to 9 pm on Sunday.Gym equipment includes treadmills, ellipticals, Peloton bikes, weight machines, cable machines, barbells, dumbbells, kettlebells, squat racks, benches, and an indoor track.",5
Swissotel Chicago,"The fitness center at the Swissotel Chicago is open from 5 am to 10 pm daily.Gym equipment includes treadmills, ellipticals, Peloton bikes, a Stairmaster, weight machines, cable machines, dumbbells, kettlebells, and benches.",4
Intercontinental Los Angeles Downtown,"Altitude Fitness is located on the seventh floor of the InterContinental Los Angeles Downtown and is free for hotel guests to use. Gym equipment includes treadmills, ellipticals, bikes, barbells, kettlebells, benches, a squat rack, and dumbbells up to 120 pounds. The gym is open from 5 AM to 9 PM on weekdays and 7 AM to 7 PM on weekends. Memberships are available.",5
1 Hotel West Hollywood,"The Field House Gym at 1 Hotel West Hollywood is open 24/7.Gym equipment includes treadmills, ellipticals, a StairMaster, a SkiErg, Peloton bikes, dumbbells, barbells, kettlebells, a squat rack, and a turf area.",5
Sheraton Grand Los Angeles,"The fitness center at the Sheraton Grand Los Angeles is open 24 hours a day and has top-of-the-line, state-of-the-art machines to help you stay in shape.The gym features treadmills, ellipticals, stationary bikes, rowing machines, weight machines, dumbbells, benches, and views of downtown LA.",4
The Westin Los Angeles Airport,"The WestinWORKOUT Fitness Studio at The Westin Los Angeles Airport is open 24 hours a day.Gym equipment includes treadmills, ellipticals, Peloton bikes, dumbbells, kettlebells, medicine balls, TRX straps, and benches.",4
The Chamberlain West Hollywood,"The 700-square-foot fitness center at The Chamberlain West Hollywood is open 24 hours a day, 7 days a week.Gym equipment includes treadmills, a Peloton bike, a smith machine, a cable machine, dumbbells, kettlebells, and benches.",4
"The Ritz-Carlton, Los Angeles","The recently updated fitness center at The Ritz-Carlton Los Angeles is open daily from 9 AM to 7 PM. Gym equipment includes treadmills, ellipticals, Peloton bikes, weight machines, cable machines, smith machine, dumbbells, and benches.",4
Sofitel Los Angeles at Beverly Hills,"The 2,000-square-foot Sofitel Fitness Center at Sofitel Los Angeles at Beverly Hills is open from 6 am to 9 pm daily.Gym equipment includes treadmills, ellipticals, Peloton bikes, an air bike, weight machines, cable machines, barbells, dumbbells, and benches.",4
The Westin Bonaventure Hotel and Suites,"The WestinWORKOUT Fitness Studio at The Westin Bonaventure Hotel and Suites is open 24 hours a day, 7 days a week.Gym equipment includes treadmills, ellipticals, weight machines, cable machines, dumbbells, kettlebells, TRX straps, and benches.",5
Four Seasons Hotel Los Angeles at Beverly Hills,"The fitness center at the Four Seasons Hotel Los Angeles at Beverly Hills is open-air and open from 6 am to 9 pm daily.Gym equipment includes treadmills, ellipticals, a Peloton bike, weight machines, cable machines, dumbbells, barbells, kettlebells, benches, and a turf area.",5
"Dream Hollywood, Part of Hyatt","The fitness center (Gunnar Peterson Gym) at the Dream Hollywood is open 24 hours a day, 7 days a week. Gym equipment includes treadmills, an elliptical, a cable machine, dumbbells, kettlebells, barbells, a squat rack, and sandbags.",5
"Marriott Marquis Washington, DC","The Marriott Marquis Washington DC offers their guests access to an 8,000 square foot, bi-level fitness center that is open 24 hours a day. Equipment includes treadmills, ellipticals, Peloton bikes, weight machines, cable machines, barbells, dumbbells, kettlebells, and a squat rack.",5
"Courtyard by Marriott Washington, DC Dupont Circle","The fitness center at the Courtyard by Marriott Washington, DC Dupont Circle is open 24 hours a day, 7 days a week.Gym equipment includes treadmills, ellipticals, stationary bikes, cable machines, dumbbells, kettlebells, and benches.",4
"Renaissance Washington, DC Downtown Hotel","Vida Fitness at the Renaissance Washington, DC Downtown Hotel is 10,000 square feet and is open 24 hours a day.Gym equipment includes treadmills, ellipticals, stationary bikes, StairMasters, weight machines, cable machines, barbells, dumbbells, kettlebells, benches, and a squat rack.",5
AC Hotel Washington DC Capitol Hill Navy Yard,"The fitness center at the AC Hotel Washington DC Capitol Hill Navy Yard is open 24 hours a day, 7 days a week.Gym equipment includes treadmills, ellipticals, stationary bikes, dumbbells, barbells, kettlebells, rings, bars, benches, and a squat rack.",5
"The Westin Georgetown, Washington DC","The fitness center at The Westin Georgetown, Washington DC is open 24 hours a day, 7 days a week.Gym equipment includes treadmills, ellipticals, Peloton bikes, a rower, cable machines, dumbbells, kettlebells, and benches.",4
Hilton Washington DC National Mall the Wharf,"The fitness center at the Hilton Washington DC National Mall the Wharf is open 24 hours a day, 7 days a week.Gym equipment includes treadmills, ellipticals, stationary bikes, a rower, weight machines, cable machines, and free weights.",3
Glover Park Hotel Georgetown,"This one was named ""best hotel gym"" by Shape Magazine in 2017 and it's no surprise. The 2,000-square-foot DC Urban Athletic Club at Kimpton Glover Park Hotel offers a squat rack, Assault Bike, Concept2 rowing machines, TRX suspension trainers, a heavy boxing bag, sleds, ropes, and gymnastic rings.",5
AC Hotel Washington DC Convention Center,"The fitness center at the AC Hotel Washington DC Convention Center is open 24 hours a day, 7 days a week.Gym equipment includes treadmills, ellipticals, a Peloton bike, a StairMaster, cable machines, weight machines, dumbbells, kettlebells, and benches.",5
The LINE Hotel DC,"The Urban Athletic Club at The LINE Hotel DC is open daily from 6 am to 10 pm.Equipment includes Rogue barbells, squat racks, Concept2 rowers, treadmills, TRX, dumbbells, benches, kettlebells, a turf area with a sled, plyo boxes, and ellipticals.",5
"Rome Cavalieri, A Waldorf Astoria Hotel","Located in the Cavalieri Grand Spa, the gym at the Rome Cavalieri, A Waldorf Astoria Hotel is open daily from 7:30 am to 9:00 pm.The spacious gym features dumbbells, barbells, kettlebells, weight machines, benches, treadmills, pull-up bars, gymnastic rings, a Stairmaster, and ellipticals.",0
Hilton Warsaw,"Holmes Place is a luxurious health and wellness club located in the Hilton Warsaw and guests of the hotel have free access.The club is over 37,000 square feet and features treadmills, bicycles, cross trainers, rowing machines, resistance machines, jump ropes, training ropes, tiers, sandbags, dumbbells, balls, Bosu Balls, barbells, kettlebells, and trampolines.You can also pre-book group training classes in Zumba or Krav Maga in a separate studio.",0
TWA Hotel,"The 10,000-square-foot fitness center at TWA Hotel at John F. Kennedy International Airport in New York City is open 24 hours a day, 7 days a week.There are kettlebells, battle ropes, monkey bars, medicine balls, sandbags, jump ropes, resistance bands, boxes, TRX straps, dumbbells up to 100 pounds, multiple benches, squat racks, barbells, and weight machines.There are also plenty of treadmills, ellipticals, stair masters, stationary bikes, Concept2 rowers, and a whole room full of Peloton bikes.",0
Boston Park Plaza,"This 20,000-square-foot Lynx Fitness Club at the Boston Park Plaza is filled with strength training and cardio equipment to provide guests with an awesome fitness experience during their stay.Equipment includes dumbbells, barbells, kettlebells, squat racks, weight machines, cardio machines, and a turf area.",0
Renaissance Washington DC Downtown Hotel,"The 10,000-square-foot Vida Fitness at the Renaissance Washington DC Downtown Hotel is open 24 hours a day.Gym equipment includes treadmills, ellipticals, stationary bikes, StairMasters, weight machines, cable machines, barbells, dumbbells, kettlebells, benches, and a squat rack.VIDA Renaissance has gained a reputation as one of the most popular hotel gyms in the United States and is home to many visiting celebrities and dignitaries.",0
The Westin Kansas City at Crown Center,"The WestinWORKOUT Studio at The Westin Kansas City at Crown Center is open daily from 6 am to 10 pm.Gym equipment includes treadmills, ellipticals, Peloton bikes, weight machines, cable machines, dumbbells, barbells, kettlebells, TRX, and benches.",0
Cleveland Marriott Downtown at Key Tower,"The 20,000-square-foot fitness center at Cleveland Marriott Downtown at Key Tower is open 24 hours a day, 7 days a week.Gym equipment includes tons of treadmills, ellipticals, weight machines, cable machines, squat racks, dumbbells, barbells, kettlebells, and more.",0
JW Marriott Indianapolis,"The spacious fitness center at JW Marriott Indianapolis features treadmills, ellipticals, spin bikes, weight machines, a Smith machine, dumbbells, barbells, benches, a cable machine, and a pull-up bar. The gym is open 24/7.",0
"Hotel Ivy, a Luxury Collection Hotel, Minneapolis","A hotel gym with two squat racks? It might seem too good to be true but the gym at the Hotel Ivy, a Luxury Collection Hotel, Minneapolis has it. Plus much more.The new 5,000-square-foot Anda Spa Fitness Center and Studios is open 24 hours a day and features treadmills, stationary bikes, Concept2 rowers, Ski Ergs, a Peloton bike, dumbbells, barbells, squat racks, and Rogue benches.",0
Hilton New Orleans Riverside,"The 100,000-square-foot Health Club at the Hilton New Orleans Riverside Hotel provides guests with an exceptional gym, featuring treadmills, recumbent bikes, ellipticals, StairMasters, rowing machines, a cycling studio, barbells, and dumbbells.There’s also a cross-training room with TRX straps,  kettlebells, battle ropes, medicine balls, heavy bags, and resistance bands. On-site personal training and group classes are available. A $12 daily resort fee is required to use the Health Club.",0
1 Hotel South Beach,"The 14,000-square-foot Anatomy South Beach Gym at 1 Hotel South Beach is open from 6 am - 9 pm on weekdays and 7 am - 8 pm on weekends.Gym equipment includes treadmills, rowing machines, weight machines, dumbbells, barbells, squat racks, TRX, boxing equipment, and kettlebells.",0
Hilton Anatole,"The 80,000-square-foot Verandah Club at the Hilton Anatole in Dallas is filled with cardio machines, barbells, and dumbbells, studios for Spinning, barre, and other classes, a boxing gym, racquetball, and squash courts; and a 25-meter lap pool.There's also a seven-acre park outside that offers a quarter-mile running track, tennis courts, and a full basketball court.",0
"The Houstonian Hotel, Club, and Spa","The Houstonian Hotel, Club, and Spa in Houston has been a pioneer in the hotel gym world, opening the 125,000 square foot Health Club back in 1980.Guests can enjoy access to 300-plus cardio and strength machines, a staff of exercise and nutrition specialists, indoor running tracks, tennis and racquetball courts, pool, yoga studio, and studios for classes.Read more: The Best Gyms in the World",0
"Carte Hotel San Diego Downtown, Curio Collection by Hilton","Guests of the Carte Hotel San Diego Downtown, Curio Collection by Hilton have access to Fit Athletic Club & Gym, located in the same building. Fit Athletic is open from 5 am to 9 pm Monday-Friday and 7 am to 7 pm Saturday and Sunday.The gym has cardio machines, weight machines, dumbbells, barbells, kettlebells, squat racks, studios, turf areas, and a rooftop training area.",0
Resorts World Las Vegas,"Resorts World Las Vegas houses three Hilton Hotels: Las Vegas Hilton at Resorts World, Conrad Las Vegas at Resorts World, and Crockfords Las Vegas.The fitness center at Resorts World Las Vegas is open daily from 5 am to 8 pm and is open to anyone staying at the three Hilton Hotels.Gym equipment includes Peloton bikes, StairMasters, weight machines, cable machines, dumbbells, barbells, kettlebells, squat racks, and a turf area with a sled.",0
W Taipei,"Fit Gym at W Taipei provides guests with an array of cardio machines, weight machines, free weights, yoga/aerobics room, and a spa in over 400 square meters.",0
W Retreat and Spa Bali,"The Mulia Fitness Centre at Hotel Mulia Senayan is newly remodeled and provides guests with a 360 degree panoramic view of Jakarta while working out. Mulia Fitness Centre provides the latest cardiovascular and weight training equipment, with personal fitness trainers and a variety of group classes available.FIT at W Retreat and Spa Bali offers an incredible health and wellness experience for guests. The facility is state-of-the-art and is open 24 hours a day. Equipment includes standard cardio machines, free weights, a detox chamber, steam room, hot stone bath, and cold plunge.What sets this one apart are the fitness programs. Morning meditation, sunrise stretching, and outdoor circuit training are just some of the many programs available.",0
Carlton Hotel Singapore,"The beautiful gym at Carlton Hotel Singapore offers cardio machines and an outstanding selection free weights, including barbells and dumbbells, to go along with open space for yoga and stretching. Take a virtual tour of the gym here.",0
Hotel Jen Beijing,"The Club on the Park gymnasium and aerobics studio flank either side of a pool on the 47th floor. The studio features body sonic flooring, while the gym is equipped with a complete range of Life Fitness weight training and fitness equipment.Floor-to-ceiling windows with a stunning view from 47 floors up make the Park Hyatt in Tokyo arguably the hotel gym with the best view.Cover photo by Hotel Jen Beijing.",0
Thompson Dallas,"The gym at the Thompson Dallas is located on the ninth floor of the hotel and is open 24 hours a day, 7 days a week.Equipment includes treadmills, ellipticals, stairmasters, a SkiErg, Peloton bikes, an airbike, rowers, squat racks, barbells, kettlebells, dumbbells, and benches.",5
Hotel Crescent Court,"The fitness center at Hotel Crescent Court is open 24 hours a day, 7 days a week.Equipment includes treadmills, ellipticals, Peloton bikes, weight machines, cable machines, squat racks, barbells, dumbbells, and benches.",5
"The Ritz-Carlton, Dallas","The fitness center at The Ritz-Carlton Dallas is open daily from 7 a.m. to 8 p.m. Equipment includes treadmills, ellipticals, stationary bikes (including a Peloton), a rower, dumbbells, kettlebells, barbells, benches, and weight machines.",4
"HALL Arts Hotel Dallas, Curio Collection by Hilton","The 2,000-square-foot fitness studio at the HALL Arts Hotel Dallas is located on the second floor of the hotel. Gym equipment includes treadmills, ellipticals, Peloton bikes, a StairMaster, weight machines, cable machines, dumbbells, kettlebells, and benches.",4
Omni Dallas Hotel,"The spacious fitness center at the Omni Dallas Hotel is open 24 hours a day, 7 days a week.Gym equipment includes treadmills, ellipticals, Peloton bikes, weight machines, cable machines, and free weights.",4
Renaissance Dallas at Plano Legacy West Hotel,"The center at the Renaissance Dallas at Plano Legacy West Hotel is open 24 hours a day, 7 days a week.Gym equipment includes treadmills, ellipticals, StairMasters, weight machines, cable machines, dumbbells, kettlebells, ropes, and benches.",3
The Westin Dallas Fort Worth Airport,"The WestinWORKOUT Fitness Studio at The Westin Fort Worth Airport is open 24 hours a day, 7 days a week. Gym equipment includes treadmills, ellipticals, a Peloton bike, cable machines, dumbbells, kettlebells, TRX, and benches.",3
Sheraton Dallas Hotel,"The 6,000-square-foot fitness center at the Sheraton Dallas Hotel is open 24 hours a day, 7 days a week.Equipment includes treadmills, ellipticals, Peloton bikes, heavy dumbbells, barbells, benches, cable machines, and weight machines.",4
Hilton Anatole Dallas,"The 80,000-square-foot Verandah Fitness Club at the Hilton Anatole Dallas is open from 5:30 AM to 8 PM Monday through Friday, 6:30 AM to 8 PM on Saturdays, and 6:30 AM to 7 PM on Sundays.Gym equipment includes treadmills, ellipticals, Peloton bikes, weight machines, cable machines, squat racks, barbells, and dumbbells.",5
Four Seasons Resort and Club Dallas at Las Colinas,"The massive gym at the Four Seasons Resort and Club Dallas at Las Colinas is open from 5:30 AM to 10 PM Monday through Friday and 6:30 AM to 9 PM on weekends.Equipment includes treadmills, ellipticals, Peloton bikes, an indoor track, weight machines, cable machines, barbells, dumbbells, and kettlebells.",5
Loews Atlanta Hotel,"Exhale at Loews Atlanta Hotel is 10,000 square feet and has a packed schedule of yoga, Core Fusion, HIIT, boot camp, and cycling classes.Gym equipment includes treadmills, ellipticals, stationary bikes, weight machines, cable machines, dumbbells, barbells, and benches.Gym memberships are available.",5
Four Seasons Hotel Atlanta,"The fitness center at the Four Seasons Hotel Atlanta is open from 7 am to 8 pm daily.Gym equipment includes treadmills, elliptical machines, Peloton bikes, weight machines, dumbbells, barbells, kettlebells, and benches.",5
W Atlanta Downtown,"The 1,700-square-foot FIT gym at W Atlanta Downtown is well-equipped with multiple cardio machines, weight machines, dumbbells, and boxing equipment.The floor-to-ceiling windows provide plenty of light to create a high-energy environment and offer fantastic views of downtown Atlanta.",3
InterContinental Buckhead Atlanta,"The state-of-the-art fitness center at the InterContinental Buckhead Atlanta is equipped with treadmills, lifecycle bikes, Stairmasters, elliptical trainers, free-weights, 47"" LCD HDTVs and locker rooms.",3
Hyatt Regency Atlanta,"Located in downtown Atlanta on Peachtree Street, the Hyatt Regency sports a 5,000-square-foot fitness center that’s open 24/7. The spacious StayFit gym features cardio and strength training equipment, including free weights, treadmills, ellipticals, bikes, weight machines, mats, and resistance bands.",3
Omni Hotel at the Battery Atlanta,"The fitness center at the Omni Hotel at the Battery Atlanta is open 24 hours a day and has floor-to-ceiling windows, allowing you to enjoy a beautiful view of SunTrust Park, the home of the Atlanta Braves.Gym equipment includes treadmills, ellipticals, spin bikes, a rower, weight machines, dumbbells, barbells, and benches.",4
The St. Regis Atlanta,"Located on the 7th floor of The St. Regis Atlanta, the Athletic Club is open 24 hours a day, 7 days a week.Gym equipment includes treadmills, ellipticals, a Peloton bike, a StairMaster, a rower, weight machines, cable machines, dumbbells, kettlebells, and benches.",4
The Westin Buckhead Atlanta,"The WestinWORKOUT® Fitness Studio at the Westin Buckhead Atlanta is open 24 hours a day, 7 days a week. Equipment includes cardio machines, weight machines, dumbbells, kettlebells, medicine balls, strength bands, and the TRX® Suspension Trainer™.",3
Thompson Buckhead,"The small but well-equipped fitness center at Thompson Buckhead, one of Atlanta’s newest hotels, is open 24 hours a day, seven days a week.Gym equipment includes two different types of treadmills, elliptical machines, Peloton bikes, weight machines, cable machines, dumbbells, and kettlebells.",4
"The Ritz-Carlton, Atlanta","The Ritz-Carlton, Atlanta is located in downtown Atlanta and the spacious fitness center located on the fourth floor was recently renovated.Gym equipment includes Peloton bikes, treadmills, elliptical machines, a rower, weight machines, dumbbells, kettlebells, and benches.",3
Sindhorn Kempinski Hotel Bangkok,"The fitness center at the Sindhorn Kempinski Hotel Bangkok is open from 6 am to 10 pm Monday-Friday and 8 am to 8 pm Saturday and Sunday.Gym equipment includes treadmills, ellipticals, bikes, weight machines, dumbbells, barbells, kettlebells, benches, a squat rack, boxing equipment, and a turf area.",5
Kimpton Maa-Lai Bangkok,"The fitness center at the Kimpton Maa-Lai Bangkok is open daily from 6 am to 10 pm.Gym equipment includes treadmills, ellipticals, bikes, a rower, weight machines, dumbbells, barbells, kettlebells, benches, and a squat rack.",5
The Siam Hotel,"The spacious and well-equipped fitness center at The Siam Hotel is open 24 hours a day, 7 days a week.Gym equipment includes treadmills, ellipticals, bikes, weight machines, dumbbells, benches, and a Muay Thai training area.",4
Sheraton Grande Sukhumvit Bangkok,"The Fitness Club at the Sheraton Grande Sukhumvit in Bangkok is a top-class facility. A strength training zone with free weights, including barbells, dumbbells, and benches, and a cardiovascular area are complemented by a group exercise area for a wide range of workouts. Professional personal trainers are available.",4
The Peninsula Bangkok,"The fitness center at The Peninsula Bangkok is open 24 hours a day, 7 days a week.Gym equipment includes treadmills, ellipticals, bikes, weight machines, kettlebells, dumbbells, and benches.Stay updated on the latest in Bangkok before you book your trip.",4
Novotel Bangkok on Siam Square,"The fitness center at the Novotel Bangkok on Siam Square is located on the fourth floor and is open daily from 6 am to 10 pm.Gym equipment includes treadmills, ellipticals, bikes, weight machines, dumbbells, barbells, and benches.",4
Siam Kempinski Hotel Bangkok,"The spacious, light-filled gym at the Siam Kempinski Hotel is equipped with cardio machines and free weights, including a Concept2 rowing machine, a Smith machine, and heavy dumbbells. The gym is open 24/7.",4
Amari Watergate Bangkok,"FIT Centre at the Amari Watergate Bangkok is a spacious fitness center that’s open from 6 a.m. to 10 p.m.The gym is loaded with free weights, including barbells and heavy dumbbells, as well as benches, cable machines, weight machines, and cardio machines. There are also group classes in yoga and boxing.",4
Carlton Hotel Bangkok Sukhumvit,"The fitness center at the Carlton Bangkok Sukhumvit is located on the tenth floor open daily from 6 am to 10 pm. Gym equipment includes treadmills, ellipticals, bikes, weight machines, cable machines, dumbbells, and benches.",4
"The Standard, Bangkok Mahanakhon","The fitness center at The Standard, Bangkok Mahanakhon is open 24 hours a day, 7 days a week.Gym equipment includes treadmills, ellipticals, Peloton bikes, a rower, weight machines, dumbbells, barbells, benches, and a squat rack.Class and gym memberships are available.",4
Hutton Hotel,"The state-of-the-art fitness center at Hutton Hotel is open 24/7.Gym equipment includes treadmills, elliptical machines, Peloton bikes, dumbbells, kettlebells, TRX training straps, and foam rollers.",4
